Hulls,Stability,Pros,Cons
Catamaran,Very Stable,"Stability, Fast Speed, Fuel Efficiency, High Maneuverability ","Large Turn Radius, Complex Handling in Waves"
Flat Bottom,Good Resting Stability,"Calm Water Stability, Shallow Water Capability","Poor Performance in Waves, Often Capsizes, Low Speed"
V-Hull,"Balanced, Not steady at rest","Cuts through Waves easily, Low Drag, Efficiency, High Maneuverability","Bad stability at low speed, High Draft, Less Cargo Capacity"
Displacement,Very Stable,"High Carrying Capacity, Fuel Efficiency, Shallow Draft","Low Speed, Bad Maneuverability, "
Trimaran,Highest Stability,"Very good stability, High Speed",Complex Design